{
  "schema_version": 1,
  "metadata": {
    "operation": "gemm_fp32",
    "implementation": "custom_register_blocked_fp32",
    "data_type": "fp32",
    "timing_scope": "kernel-only",
    "dimensions": {
      "k": 1024,
      "m": 1024,
      "n": 1024
    },
    "launch": {
      "grid": [16, 16, 1],
      "block": [16, 16, 1],
      "dynamic_shared_memory_bytes": 0
    },
    "gpu_name": "NVIDIA GeForce RTX 3050 Laptop GPU",
    "compute_capability": "8.6",
    "gpu_global_memory_bytes": 4294443008,
    "cuda_driver_version": "13.4",
    "cuda_runtime_version": "12.6",
    "build_type": "Release",
    "compiler": "MSVC 19.44.35228.0",
    "git_commit": "f88127e",
    "timestamp_utc": "2026-09-20T09:36:44Z"
  },
  "config": {
    "warmup_iterations": 50,
    "measurement_iterations": 100,
    "seed": 2027
  },
  "statistics_ms": {
    "sample_count": 100,
    "minimum": 1.0854400396347046,
    "mean": 1.1451923096179961,
    "median": 1.0947039723396301,
    "p95": 1.4203903675079346,
    "standard_deviation": 0.13256020072996663
  },
  "correctness": {
    "passed": true,
    "element_count": 1048576,
    "failure_count": 0,
    "worst_index": 113532,
    "max_absolute_error": 2.002716064453125e-05,
    "mean_absolute_error": 9.9590610986541621e-07,
    "max_relative_error": 0.57372922897338863,
    "expected_at_worst": -9.5681552886962891,
    "actual_at_worst": -9.5681352615356445
  },
  "metrics": {
    "absolute_tolerance": 0.0001,
    "cublas_median_ms": 0.52736002206802368,
    "flop_count": 2147483648,
    "gflops_from_median": 1961.7026175673241,
    "percent_of_cublas": 48.173756138011996,
    "relative_tolerance": 0.0001,
    "static_shared_memory_bytes": 8512,
    "validated_against_cpu": 0,
    "validated_against_cublas": 1
  },
  "samples_ms": [1.1118719577789307, 1.4007680416107178, 1.0926079750061035, 1.0947519540786743, 1.0923839807510376, 1.0955840349197388, 1.0984640121459961, 1.4223359823226929, 1.1018240451812744, 1.1008000373840332, 1.1048959493637085, 1.1038719415664673, 1.1008000373840332, 1.4192639589309692, 1.1038719415664673, 1.0977280139923096, 1.1028480529785156, 1.1038719415664673, 1.099776029586792, 1.7182719707489014, 1.099776029586792, 1.0994880199432373, 1.0977280139923096, 1.0977280139923096, 1.0966720581054688, 1.3936640024185181, 1.1008000373840332, 1.1008000373840332, 1.0946559906005859, 1.0956799983978271, 1.4202879667282104, 1.099776029586792, 1.0946559906005859, 1.0946240425109863, 1.0956799983978271, 1.0956799983978271, 1.4202879667282104, 1.0977280139923096, 1.0974400043487549, 1.0954240560531616, 1.0936319828033447, 1.0905599594116211, 1.4169919490814209, 1.0967040061950684, 1.0895359516143799, 1.0946559906005859, 1.0914880037307739, 1.0954560041427612, 1.4097599983215332, 1.0956799983978271, 1.0915839672088623, 1.0946559906005859, 1.0936319828033447, 1.0946559906005859, 1.4223359823226929, 1.0956799983978271, 1.0895359516143799, 1.09660804271698, 1.0915839672088623, 1.0956799983978271, 1.0926079750061035, 1.0946559906005859, 1.0885119438171387, 1.0946559906005859, 1.0936319828033447, 1.0926079750061035, 1.4424959421157837, 1.1038719415664673, 1.09552001953125, 1.0926079750061035, 1.0923199653625488, 1.0905599594116211, 1.7018879652023315, 1.0936319828033447, 1.0864640474319458, 1.0885119438171387, 1.087488055229187, 1.0885119438171387, 1.4110720157623291, 1.0914880037307739, 1.0885119438171387, 1.0894399881362915, 1.087488055229187, 1.4039039611816406, 1.0885119438171387, 1.0905599594116211, 1.0895359516143799, 1.0854400396347046, 1.0885119438171387, 1.0905599594116211, 1.0915839672088623, 1.0885119438171387, 1.0905599594116211, 1.0895359516143799, 1.0894080400466919, 1.0926079750061035, 1.087488055229187, 1.0895359516143799, 1.0885119438171387, 1.0903359651565552]
}
