{
  "schema_version": 1,
  "metadata": {
    "operation": "gemm_fp16_fp32",
    "implementation": "cublas_fp16_fp32",
    "data_type": "fp16_input_fp32_accumulation",
    "timing_scope": "kernel-only",
    "dimensions": {
      "k": 2048,
      "m": 2048,
      "n": 2048
    },
    "launch": {
      "grid": [1, 1, 1],
      "block": [1, 1, 1],
      "dynamic_shared_memory_bytes": 0
    },
    "gpu_name": "NVIDIA GeForce RTX 3050 Laptop GPU",
    "compute_capability": "8.6",
    "gpu_global_memory_bytes": 4294443008,
    "cuda_driver_version": "13.4",
    "cuda_runtime_version": "12.6",
    "build_type": "Release",
    "compiler": "MSVC 19.44.35228.0",
    "git_commit": "f88127e",
    "timestamp_utc": "2026-09-20T09:37:05Z"
  },
  "config": {
    "warmup_iterations": 50,
    "measurement_iterations": 100,
    "seed": 2027
  },
  "statistics_ms": {
    "sample_count": 100,
    "minimum": 1.5626239776611328,
    "mean": 1.6780748748779297,
    "median": 1.5911839604377747,
    "p95": 2.0020735740661619,
    "standard_deviation": 0.18162513206712314
  },
  "correctness": {
    "passed": true,
    "element_count": 4194304,
    "failure_count": 0,
    "worst_index": 0,
    "max_absolute_error": 0,
    "mean_absolute_error": 0,
    "max_relative_error": 0,
    "expected_at_worst": 0,
    "actual_at_worst": 0
  },
  "metrics": {
    "absolute_tolerance": 0.010999999999999999,
    "cublas_median_ms": 1.5911839604377747,
    "flop_count": 17179869184,
    "gflops_from_median": 10796.909478193449,
    "percent_of_cublas": 100,
    "relative_tolerance": 0.01,
    "static_shared_memory_bytes": 0,
    "validated_against_cpu": 0,
    "validated_against_cublas": 0
  },
  "samples_ms": [2.3193600177764893, 1.6261119842529297, 1.6065599918365479, 2.2353920936584473, 1.6691199541091919, 1.5872000455856323, 1.5892479419708252, 1.9496959447860718, 1.605631947517395, 1.5912959575653076, 1.5882240533828735, 1.9496959447860718, 1.5841280221939087, 1.5912959575653076, 1.5851520299911499, 1.9456000328063965, 1.6261119842529297, 1.5790079832077026, 1.5790079832077026, 1.9496959447860718, 1.5841280221939087, 1.5790079832077026, 1.5841280221939087, 1.5800319910049438, 1.5810559988021851, 1.5831040143966675, 1.5820800065994263, 1.5749119520187378, 2.0244479179382324, 1.5910719633102417, 1.5810559988021851, 1.5871679782867432, 2.2743039131164551, 1.661952018737793, 1.605631947517395, 1.6035840511322021, 1.938431978225708, 1.6136319637298584, 1.6033600568771362, 1.9630080461502075, 1.649664044380188, 1.5779839754104614, 1.5757119655609131, 1.9271680116653442, 1.5943679809570312, 1.5738879442214966, 1.5736000537872314, 1.571679949760437, 1.5738879442214966, 1.5769599676132202, 1.5697920322418213, 1.5656960010528564, 1.9179519414901733, 1.5646719932556152, 1.5644160509109497, 1.5646719932556152, 1.9343359470367432, 1.5646719932556152, 1.5626239776611328, 1.5695359706878662, 1.9415040016174316, 1.5646719932556152, 1.5747840404510498, 1.6014399528503418, 1.9496959447860718, 1.5892479419708252, 1.5851520299911499, 1.5839680433273315, 1.9537919759750366, 1.6414719820022583, 1.5892479419708252, 1.5882240533828735, 1.9456000328063965, 1.5831040143966675, 1.5872000455856323, 1.5861760377883911, 1.9476480484008789, 1.6005120277404785, 1.5851520299911499, 1.5841280221939087, 1.5820800065994263, 1.5882240533828735, 1.5861120223999023, 1.5851520299911499, 1.5820800065994263, 2.183135986328125, 1.5964159965515137, 1.5964159965515137, 1.5932480096817017, 1.9496959447860718, 1.5923199653625488, 1.5912959575653076, 1.5912959575653076, 1.5964159965515137, 1.5943679809570312, 1.5933120250701904, 1.5923199653625488, 2.0008959770202637, 1.6025600433349609, 1.6005120277404785]
}
