{
  "schema_version": 1,
  "metadata": {
    "operation": "transfer_roundtrip",
    "implementation": "pageable_sync",
    "data_type": "fp32",
    "timing_scope": "end-to-end",
    "dimensions": {
      "elements": 16777216
    },
    "launch": {
      "grid": [1, 1, 1],
      "block": [1, 1, 1],
      "dynamic_shared_memory_bytes": 0
    },
    "gpu_name": "NVIDIA GeForce RTX 3050 Laptop GPU",
    "compute_capability": "8.6",
    "gpu_global_memory_bytes": 4294443008,
    "cuda_driver_version": "13.4",
    "cuda_runtime_version": "12.6",
    "build_type": "Release",
    "compiler": "MSVC 19.44.35228.0",
    "git_commit": "3c30bc7",
    "timestamp_utc": "2026-09-20T08:44:21Z"
  },
  "config": {
    "warmup_iterations": 50,
    "measurement_iterations": 500,
    "seed": 2027
  },
  "statistics_ms": {
    "sample_count": 500,
    "minimum": 17.277200000000001,
    "mean": 17.805873000000005,
    "median": 17.6203,
    "p95": 18.788754999999998,
    "standard_deviation": 0.47693571752207492
  },
  "correctness": {
    "passed": true,
    "element_count": 16777216,
    "failure_count": 0,
    "worst_index": 0,
    "max_absolute_error": 0,
    "mean_absolute_error": 0,
    "max_relative_error": 0,
    "expected_at_worst": 0,
    "actual_at_worst": 0
  },
  "metrics": {
    "effective_bandwidth_gbps_from_median": 7.617221500201472
  },
  "samples_ms": [18.392199999999999, 17.8995, 19.0747, 18.068899999999999, 17.668199999999999, 17.532699999999998, 17.5702, 17.451599999999999, 18.006900000000002, 18.159300000000002, 17.482800000000001, 17.462299999999999, 17.5778, 17.464600000000001, 17.6296, 18.042899999999999, 17.558900000000001, 17.504000000000001, 17.488499999999998, 17.502600000000001, 17.460799999999999, 18.2013, 17.496300000000002, 17.576499999999999, 17.482700000000001, 17.785799999999998, 17.8979, 18.079499999999999, 17.697399999999998, 17.513000000000002, 17.572500000000002, 17.720700000000001, 17.7989, 17.6433, 17.595700000000001, 17.470700000000001, 17.886199999999999, 17.593900000000001, 17.9697, 17.7285, 17.4739, 17.578099999999999, 17.4359, 18.171800000000001, 17.571000000000002, 17.512499999999999, 17.7193, 17.5625, 17.555199999999999, 17.925799999999999, 17.893599999999999, 17.678699999999999, 19.087700000000002, 17.656300000000002, 17.609200000000001, 17.947500000000002, 17.508800000000001, 17.427800000000001, 18.196200000000001, 17.877500000000001, 17.817599999999999, 17.5625, 17.479500000000002, 17.433900000000001, 17.434699999999999, 18.980699999999999, 18.572900000000001, 17.43, 17.4847, 17.395800000000001, 17.458300000000001, 17.654199999999999, 17.9221, 17.570499999999999, 17.407699999999998, 17.700800000000001, 19.045300000000001, 19.0107, 18.5717, 19.559799999999999, 18.1126, 18.4788, 18.533100000000001, 19.479700000000001, 18.287800000000001, 18.627500000000001, 18.2759, 18.414999999999999, 18.7194, 18.890999999999998, 18.436, 17.513999999999999, 17.528700000000001, 18.453099999999999, 18.7485, 18.6693, 18.146599999999999, 18.305, 17.558199999999999, 18.7822, 17.829699999999999, 17.619900000000001, 17.557600000000001, 18.3901, 17.668099999999999, 17.7746, 17.468699999999998, 18.686199999999999, 18.097200000000001, 17.630600000000001, 17.961500000000001, 17.585000000000001, 17.4191, 17.386600000000001, 18.0501, 17.611599999999999, 17.866299999999999, 17.450700000000001, 17.405100000000001, 17.490600000000001, 18.271899999999999, 18.087800000000001, 17.632400000000001, 17.6082, 19.716799999999999, 18.971499999999999, 18.757100000000001, 19.651700000000002, 20.0885, 19.376200000000001, 17.677, 17.664899999999999, 18.5701, 17.421900000000001, 17.8444, 17.491399999999999, 17.517600000000002, 17.911300000000001, 18.1526, 17.578099999999999, 17.529699999999998, 17.5486, 17.449400000000001, 17.6571, 17.844200000000001, 17.471399999999999, 17.528600000000001, 17.498100000000001, 17.501999999999999, 17.891300000000001, 17.504799999999999, 17.5291, 17.4922, 17.536200000000001, 17.405000000000001, 17.901399999999999, 17.688500000000001, 17.647400000000001, 17.481400000000001, 18.046800000000001, 17.449400000000001, 18.028400000000001, 17.773, 18.145, 18.3354, 17.583600000000001, 17.816299999999998, 17.599900000000002, 17.496300000000002, 17.433299999999999, 18.6143, 17.638300000000001, 17.980799999999999, 17.439599999999999, 17.438600000000001, 17.5503, 17.6448, 17.398399999999999, 17.9587, 17.305399999999999, 17.572099999999999, 17.461500000000001, 17.8185, 19.177399999999999, 17.406500000000001, 18.9434, 18.7469, 18.730399999999999, 17.743600000000001, 18.02, 17.499300000000002, 17.448499999999999, 18.515000000000001, 19.622199999999999, 19.546700000000001, 17.594200000000001, 17.5535, 17.458300000000001, 17.547599999999999, 17.714700000000001, 17.897600000000001, 17.498699999999999, 17.445699999999999, 17.479600000000001, 17.505299999999998, 17.496099999999998, 18.053999999999998, 17.665900000000001, 17.407299999999999, 17.428699999999999, 17.4057, 17.503499999999999, 17.812899999999999, 17.573499999999999, 17.4483, 17.497599999999998, 17.490300000000001, 18.170100000000001, 18.205400000000001, 17.485700000000001, 18.2881, 18.422899999999998, 17.810099999999998, 17.957599999999999, 17.4833, 17.590599999999998, 17.925799999999999, 17.648, 17.497199999999999, 17.9727, 17.4801, 17.417100000000001, 18.785, 18.3718, 18.002600000000001, 17.462599999999998, 17.5, 17.451899999999998, 17.665600000000001, 17.844200000000001, 17.831600000000002, 17.535499999999999, 17.367000000000001, 17.460100000000001, 18.023800000000001, 17.689499999999999, 17.7439, 17.462199999999999, 17.4528, 17.911899999999999, 18.043399999999998, 18.152000000000001, 17.8931, 17.540500000000002, 17.5425, 18.123200000000001, 18.747299999999999, 18.438800000000001, 17.340699999999998, 17.3474, 17.277200000000001, 17.4727, 17.600999999999999, 17.706, 17.4193, 17.834700000000002, 17.4209, 17.571400000000001, 18.069600000000001, 17.511600000000001, 17.706800000000001, 17.490400000000001, 17.604700000000001, 17.449300000000001, 18.106000000000002, 17.521000000000001, 17.861499999999999, 17.5731, 17.516400000000001, 17.7133, 17.572900000000001, 17.454599999999999, 18.168500000000002, 17.528400000000001, 17.431100000000001, 18.043800000000001, 17.477900000000002, 17.415900000000001, 17.770399999999999, 17.619800000000001, 17.620699999999999, 18.133900000000001, 17.6341, 17.527999999999999, 17.6144, 17.461300000000001, 17.726900000000001, 17.9147, 17.524999999999999, 17.551400000000001, 17.584099999999999, 17.631799999999998, 18.6129, 18.762699999999999, 18.635999999999999, 18.595700000000001, 19.376100000000001, 19.393999999999998, 19.163699999999999, 18.569500000000001, 18.889299999999999, 19.952999999999999, 18.5532, 17.831199999999999, 17.788399999999999, 17.4893, 17.5581, 17.440799999999999, 17.6111, 18.077999999999999, 17.584399999999999, 17.5063, 17.666399999999999, 17.447700000000001, 17.847000000000001, 17.548300000000001, 17.477, 17.713999999999999, 17.397400000000001, 17.5441, 17.848800000000001, 17.7044, 17.838899999999999, 17.5105, 17.615500000000001, 17.632200000000001, 17.895299999999999, 17.4801, 18.2227, 17.5093, 17.863, 17.5624, 17.871300000000002, 17.480799999999999, 17.557700000000001, 17.4542, 17.5318, 19.893899999999999, 17.5397, 17.57, 18.0745, 17.561499999999999, 17.614799999999999, 18.0852, 17.642299999999999, 17.448799999999999, 17.598500000000001, 17.631399999999999, 18.0137, 17.520800000000001, 17.500599999999999, 17.511900000000001, 17.501799999999999, 17.893899999999999, 17.970800000000001, 17.636099999999999, 17.494800000000001, 17.915600000000001, 17.751899999999999, 17.544599999999999, 17.799399999999999, 17.513500000000001, 17.464400000000001, 17.496600000000001, 17.631499999999999, 17.572800000000001, 17.873100000000001, 17.5076, 17.496099999999998, 17.434000000000001, 17.4542, 17.737100000000002, 17.7849, 17.5321, 17.967099999999999, 17.9619, 17.642900000000001, 17.8352, 17.662600000000001, 17.814800000000002, 17.440200000000001, 17.720600000000001, 17.5444, 17.817900000000002, 18.127300000000002, 17.705300000000001, 17.6128, 18.196999999999999, 18.0517, 17.601800000000001, 17.648900000000001, 17.5303, 17.618600000000001, 18.378399999999999, 19.024899999999999, 18.659700000000001, 17.598500000000001, 17.621600000000001, 17.648499999999999, 17.412800000000001, 17.959, 17.52, 17.444800000000001, 17.540800000000001, 17.726700000000001, 17.809200000000001, 17.396999999999998, 17.514299999999999, 17.499500000000001, 17.566600000000001, 17.841799999999999, 17.9832, 17.403500000000001, 17.492999999999999, 18.263300000000001, 17.4815, 17.6401, 17.807300000000001, 17.431799999999999, 17.571000000000002, 17.490200000000002, 17.498999999999999, 17.9467, 17.415400000000002, 17.622, 17.402000000000001, 17.534400000000002, 17.374300000000002, 17.983599999999999, 17.5166, 17.593299999999999, 17.5534, 17.633700000000001, 17.4527, 18.043700000000001, 17.946300000000001, 17.517700000000001, 17.4923, 17.366199999999999, 17.8566, 17.537099999999999, 18.3748, 17.403300000000002, 17.485199999999999, 17.580100000000002, 17.990600000000001, 17.433, 17.626300000000001, 17.4437, 17.407399999999999, 17.421299999999999, 17.756499999999999, 17.578399999999998, 17.565000000000001, 17.5105, 17.461400000000001, 17.4192, 17.822600000000001, 17.670500000000001, 17.382899999999999, 17.5152, 17.528700000000001, 18.072099999999999, 17.629200000000001, 17.863499999999998, 18.860099999999999, 17.6525, 17.824100000000001, 17.861699999999999, 17.5578, 17.856200000000001, 17.9254, 17.662099999999999, 17.420100000000001, 17.803100000000001, 17.458200000000001, 17.629200000000001, 17.451899999999998, 17.598299999999998, 17.842099999999999, 17.805599999999998, 17.530899999999999, 17.395299999999999, 17.439299999999999, 17.3857, 17.769400000000001, 17.4437, 17.535699999999999, 17.3949, 17.6142]
}
