{
  "schema_version": 1,
  "metadata": {
    "operation": "saxpy_pipeline",
    "implementation": "two_stream_chunked",
    "data_type": "fp32",
    "timing_scope": "end-to-end",
    "dimensions": {
      "chunks": 8,
      "elements": 16777216,
      "streams": 2
    },
    "launch": {
      "grid": [1, 1, 1],
      "block": [1, 1, 1],
      "dynamic_shared_memory_bytes": 0
    },
    "gpu_name": "NVIDIA GeForce RTX 3050 Laptop GPU",
    "compute_capability": "8.6",
    "gpu_global_memory_bytes": 4294443008,
    "cuda_driver_version": "13.4",
    "cuda_runtime_version": "12.6",
    "build_type": "Release",
    "compiler": "MSVC 19.44.35228.0",
    "git_commit": "3c30bc7",
    "timestamp_utc": "2026-09-20T08:45:03Z"
  },
  "config": {
    "warmup_iterations": 50,
    "measurement_iterations": 500,
    "seed": 2027
  },
  "statistics_ms": {
    "sample_count": 500,
    "minimum": 17.438300000000002,
    "mean": 17.729178600000004,
    "median": 17.707149999999999,
    "p95": 17.996039999999997,
    "standard_deviation": 0.13413626637847029
  },
  "correctness": {
    "passed": true,
    "element_count": 16777216,
    "failure_count": 0,
    "worst_index": 779,
    "max_absolute_error": 2.384185791015625e-07,
    "mean_absolute_error": 6.1533249606782192e-09,
    "max_relative_error": 0.083333333333333329,
    "expected_at_worst": 2.1832265853881836,
    "actual_at_worst": 2.1832268238067627
  },
  "metrics": {
    "effective_bandwidth_gbps_from_median": 11.369790847200143
  },
  "samples_ms": [17.687999999999999, 17.773, 17.7453, 17.613099999999999, 17.699200000000001, 17.663699999999999, 17.648599999999998, 17.758700000000001, 17.711300000000001, 17.811499999999999, 18.1858, 17.690000000000001, 17.744299999999999, 17.800699999999999, 18.203499999999998, 17.779199999999999, 17.6843, 17.659800000000001, 17.805099999999999, 17.675999999999998, 17.7102, 17.675899999999999, 17.689, 17.987200000000001, 17.841000000000001, 17.726400000000002, 17.802199999999999, 17.754000000000001, 17.582999999999998, 17.6875, 17.9193, 17.7133, 17.651199999999999, 17.778099999999998, 17.536300000000001, 17.6083, 17.5458, 17.651499999999999, 18.172999999999998, 17.440899999999999, 17.492799999999999, 17.561599999999999, 17.709700000000002, 17.788499999999999, 17.720700000000001, 17.601099999999999, 17.974699999999999, 18.101400000000002, 17.6995, 17.6449, 17.460999999999999, 17.7789, 17.6797, 17.6785, 17.6464, 17.550699999999999, 17.572199999999999, 17.555, 18.051500000000001, 17.684200000000001, 17.780000000000001, 17.738, 18.253499999999999, 17.712499999999999, 17.7639, 17.6934, 17.765000000000001, 17.709800000000001, 17.716000000000001, 17.771100000000001, 18.0883, 17.6815, 17.668099999999999, 17.665800000000001, 17.767900000000001, 17.726199999999999, 17.7379, 17.678999999999998, 17.6189, 17.681000000000001, 17.7363, 17.591000000000001, 18.167200000000001, 17.730799999999999, 17.715900000000001, 17.747699999999998, 17.7545, 17.715, 17.731200000000001, 17.7285, 17.696999999999999, 17.652999999999999, 17.756699999999999, 17.616099999999999, 17.7407, 17.974499999999999, 17.936599999999999, 17.756399999999999, 17.7437, 17.648900000000001, 17.669799999999999, 17.723700000000001, 17.656199999999998, 17.770499999999998, 17.7117, 17.7227, 17.682400000000001, 17.717099999999999, 17.687200000000001, 18.0611, 17.767700000000001, 17.686499999999999, 17.761199999999999, 17.660699999999999, 17.801500000000001, 17.6831, 17.735800000000001, 17.6187, 17.649799999999999, 17.772500000000001, 17.7514, 17.683399999999999, 17.6997, 17.635899999999999, 17.822700000000001, 17.757000000000001, 17.714099999999998, 18.1007, 17.705500000000001, 17.6464, 17.648700000000002, 17.781700000000001, 17.755500000000001, 17.692299999999999, 17.752300000000002, 17.674299999999999, 17.6372, 17.770299999999999, 17.7197, 17.703399999999998, 17.835100000000001, 17.709299999999999, 17.676100000000002, 17.787500000000001, 17.751000000000001, 17.727900000000002, 17.700500000000002, 17.6707, 17.795300000000001, 17.7179, 17.7258, 17.6479, 17.690100000000001, 17.675000000000001, 17.7319, 17.671600000000002, 17.793500000000002, 17.7941, 17.6632, 17.635400000000001, 17.741099999999999, 17.662299999999998, 17.618400000000001, 17.590299999999999, 17.544799999999999, 17.684699999999999, 17.699999999999999, 17.908799999999999, 18.1342, 17.783000000000001, 17.776399999999999, 17.721599999999999, 17.7803, 17.631799999999998, 17.713000000000001, 17.733899999999998, 17.682600000000001, 17.857600000000001, 17.6416, 17.733000000000001, 17.710799999999999, 18.032900000000001, 17.5961, 17.884899999999998, 17.450299999999999, 18.297499999999999, 17.752199999999998, 17.737300000000001, 17.7774, 17.6496, 17.747800000000002, 17.717300000000002, 17.666699999999999, 17.7469, 17.933800000000002, 17.624300000000002, 18.271699999999999, 17.742799999999999, 17.642900000000001, 17.744499999999999, 17.747699999999998, 17.666, 17.812100000000001, 17.694199999999999, 17.4971, 18.112200000000001, 17.868300000000001, 17.6342, 17.721399999999999, 17.743099999999998, 17.654199999999999, 18.1236, 17.706399999999999, 17.714099999999998, 17.630800000000001, 17.656099999999999, 17.7851, 17.685600000000001, 17.809999999999999, 17.709599999999998, 17.731200000000001, 17.686499999999999, 17.7866, 17.839300000000001, 17.7559, 17.628799999999998, 17.7151, 17.6678, 17.7012, 17.649999999999999, 17.6967, 17.698699999999999, 17.678899999999999, 17.830100000000002, 17.768699999999999, 17.733899999999998, 17.6266, 17.596699999999998, 17.646899999999999, 17.918299999999999, 17.539999999999999, 17.438300000000002, 18.270900000000001, 17.661999999999999, 17.682099999999998, 17.781199999999998, 17.6478, 17.761500000000002, 17.649799999999999, 17.752700000000001, 17.9148, 17.6357, 17.625900000000001, 17.665500000000002, 17.613499999999998, 17.7256, 17.856200000000001, 17.719200000000001, 17.705200000000001, 17.617799999999999, 17.625, 17.677399999999999, 17.6843, 17.6877, 17.684999999999999, 17.6129, 17.670300000000001, 17.8001, 17.7088, 17.7258, 17.619599999999998, 17.656400000000001, 17.666499999999999, 17.7013, 17.6936, 17.734300000000001, 17.6693, 17.667999999999999, 17.744499999999999, 17.701599999999999, 17.878499999999999, 17.670200000000001, 17.713699999999999, 17.725100000000001, 18.078600000000002, 17.7254, 17.667899999999999, 17.682500000000001, 17.652699999999999, 17.6768, 17.793199999999999, 17.784600000000001, 17.7622, 17.723400000000002, 17.675599999999999, 17.9664, 17.875599999999999, 17.6602, 17.6706, 17.729199999999999, 17.654399999999999, 17.748999999999999, 17.744199999999999, 17.645600000000002, 17.7425, 17.764600000000002, 17.681799999999999, 17.822299999999998, 17.6738, 17.6648, 17.664200000000001, 17.6965, 17.635899999999999, 18.5535, 17.890799999999999, 17.753399999999999, 17.706099999999999, 17.667400000000001, 17.767700000000001, 17.720400000000001, 17.6982, 17.669699999999999, 17.6585, 17.7698, 17.7974, 17.763100000000001, 17.681699999999999, 17.7224, 17.625900000000001, 17.722200000000001, 17.780899999999999, 17.721399999999999, 17.680800000000001, 17.606100000000001, 17.644600000000001, 17.6432, 17.9421, 17.696000000000002, 17.725899999999999, 17.6568, 17.727799999999998, 17.758400000000002, 17.663699999999999, 17.7483, 17.6402, 17.671800000000001, 17.668199999999999, 17.720199999999998, 17.827300000000001, 17.777699999999999, 17.659800000000001, 17.706199999999999, 18.041499999999999, 17.630800000000001, 17.709700000000002, 17.764099999999999, 17.614699999999999, 17.599299999999999, 17.9755, 17.790299999999998, 17.666799999999999, 17.7849, 17.6326, 17.763999999999999, 17.745899999999999, 17.661999999999999, 17.669799999999999, 17.689699999999998, 17.704799999999999, 17.632200000000001, 17.984999999999999, 17.714600000000001, 17.7517, 17.618200000000002, 17.493300000000001, 17.9941, 17.738199999999999, 17.912400000000002, 17.826599999999999, 17.820499999999999, 17.6099, 17.6798, 17.724699999999999, 17.661300000000001, 17.554500000000001, 17.965800000000002, 17.8612, 17.707899999999999, 17.745100000000001, 17.6008, 17.642600000000002, 17.633199999999999, 17.910499999999999, 17.718, 17.6905, 17.742100000000001, 17.681899999999999, 17.664400000000001, 17.7437, 17.677499999999998, 17.602599999999999, 17.6995, 17.665400000000002, 17.6587, 17.754000000000001, 17.7331, 17.6616, 17.675799999999999, 18.1279, 17.764299999999999, 17.6968, 17.663599999999999, 17.671099999999999, 17.631, 17.757300000000001, 17.762499999999999, 17.567599999999999, 17.5686, 18.169699999999999, 17.728400000000001, 17.653500000000001, 17.740600000000001, 17.625699999999998, 17.7165, 17.701499999999999, 17.674099999999999, 17.6934, 17.7029, 17.778600000000001, 17.614699999999999, 17.524699999999999, 17.603300000000001, 17.715699999999998, 17.582999999999998, 17.5733, 17.581700000000001, 18.250299999999999, 17.698, 17.702400000000001, 17.733899999999998, 17.6737, 17.657800000000002, 17.736799999999999, 17.858899999999998, 17.697399999999998, 17.685500000000001, 17.692799999999998, 17.659300000000002, 17.7255, 17.520499999999998, 17.7438, 17.563700000000001, 17.491299999999999, 17.4543, 17.993200000000002, 18.0718, 17.694700000000001, 17.680199999999999, 17.6615, 17.741, 17.7379, 17.909300000000002, 17.6233, 17.6174, 17.518000000000001, 17.8523, 17.694800000000001, 18.241599999999998, 17.745799999999999, 17.640799999999999, 17.684200000000001, 17.6569, 17.7347, 17.874199999999998, 17.729299999999999, 17.7104, 17.635300000000001, 17.796199999999999, 17.724900000000002, 17.7285, 17.719200000000001, 17.6633, 17.795400000000001, 17.745999999999999, 17.748799999999999, 17.636800000000001, 17.729900000000001, 17.692799999999998, 17.720800000000001, 17.708600000000001, 17.686199999999999, 17.743200000000002, 17.696000000000002, 17.6783, 17.714300000000001, 17.701799999999999, 17.637499999999999, 17.601800000000001, 17.526800000000001, 17.504300000000001]
}
