{
  "schema_version": 1,
  "metadata": {
    "operation": "pinned_silu_pipeline",
    "implementation": "single_stream",
    "data_type": "fp32",
    "timing_scope": "end-to-end",
    "dimensions": {
      "chunks": 8,
      "elements": 16777216,
      "streams": 1
    },
    "launch": {
      "grid": [8192, 1, 1],
      "block": [256, 1, 1],
      "dynamic_shared_memory_bytes": 0
    },
    "gpu_name": "NVIDIA GeForce RTX 3050 Laptop GPU",
    "compute_capability": "8.6",
    "gpu_global_memory_bytes": 4294443008,
    "cuda_driver_version": "13.4",
    "cuda_runtime_version": "12.6",
    "build_type": "Release",
    "compiler": "MSVC 19.44.35228.0",
    "git_commit": "e8803f2",
    "timestamp_utc": "2026-09-22T11:36:20Z"
  },
  "config": {
    "warmup_iterations": 50,
    "measurement_iterations": 500,
    "seed": 2027
  },
  "statistics_ms": {
    "sample_count": 500,
    "minimum": 12.0068,
    "mean": 12.651898400000013,
    "median": 12.671849999999999,
    "p95": 12.919584999999998,
    "standard_deviation": 0.2016630726414094
  },
  "correctness": {
    "passed": true,
    "element_count": 16777216,
    "failure_count": 0,
    "worst_index": 0,
    "max_absolute_error": 4.76837158203125e-07,
    "mean_absolute_error": 3.5760076233684699e-08,
    "max_relative_error": 2.35512839806757e-07,
    "expected_at_worst": 4.5084223747253418,
    "actual_at_worst": 4.5084228515625
  },
  "metrics": {
    "absolute_tolerance": 1.0000000000000001e-05,
    "effective_bandwidth_gbps_from_median": 10.591802144122603,
    "logical_bytes": 134217728,
    "logical_reads_per_element": 1,
    "logical_writes_per_element": 1,
    "relative_tolerance": 1.0000000000000001e-05,
    "speedup_vs_operation_baseline": 1
  },
  "samples_ms": [12.839600000000001, 12.7087, 12.6661, 12.640700000000001, 12.6861, 12.606, 12.8049, 12.7293, 12.6065, 12.771100000000001, 12.6944, 12.731299999999999, 12.726100000000001, 12.707599999999999, 12.637499999999999, 12.6046, 12.7211, 12.7743, 12.717000000000001, 12.8261, 12.5762, 12.7285, 12.6562, 12.7049, 12.634, 12.5289, 12.6698, 12.5983, 12.725, 12.598000000000001, 12.5624, 12.6273, 12.5932, 12.741400000000001, 12.633699999999999, 12.7508, 12.5519, 12.533200000000001, 12.726900000000001, 12.6732, 12.5602, 12.6578, 12.477, 12.5242, 12.540900000000001, 12.5585, 12.604699999999999, 12.5715, 12.672700000000001, 12.6975, 12.7249, 12.580399999999999, 12.7888, 12.4374, 12.4162, 12.6058, 12.7662, 12.637499999999999, 12.6066, 12.5473, 12.638500000000001, 12.697900000000001, 12.6845, 12.6286, 12.5002, 13.0572, 12.750999999999999, 12.8795, 12.7151, 12.6622, 12.6706, 12.661799999999999, 12.742000000000001, 12.8306, 12.617900000000001, 12.6805, 12.617900000000001, 12.834099999999999, 12.6081, 12.5107, 12.3079, 12.3933, 12.3667, 12.364800000000001, 12.3706, 12.447900000000001, 13.0327, 12.707100000000001, 12.7803, 12.8316, 12.936400000000001, 12.8863, 12.7873, 12.65, 12.6996, 12.6585, 12.6875, 12.3813, 12.7026, 12.337999999999999, 12.071899999999999, 12.190799999999999, 12.0869, 12.362299999999999, 12.0068, 12.154199999999999, 12.807399999999999, 12.2798, 12.216799999999999, 12.4596, 12.447800000000001, 12.459300000000001, 12.6249, 12.530099999999999, 12.678100000000001, 12.7387, 12.5212, 12.864100000000001, 12.7052, 12.869, 12.799200000000001, 12.648999999999999, 12.8009, 12.4666, 12.6328, 12.6393, 12.654500000000001, 12.6502, 12.5419, 12.6797, 12.6952, 12.8939, 12.763, 12.7346, 12.680199999999999, 12.6137, 12.645300000000001, 12.3863, 12.473100000000001, 12.6014, 12.7746, 12.5175, 12.4285, 12.477600000000001, 12.458399999999999, 12.669499999999999, 12.978199999999999, 12.510999999999999, 12.669, 12.4975, 12.513400000000001, 12.5947, 12.4199, 12.3748, 12.5182, 12.2949, 12.4206, 12.4877, 12.371600000000001, 12.356400000000001, 12.4322, 12.3834, 12.361000000000001, 12.3422, 12.3337, 12.325799999999999, 12.596, 12.7882, 12.596500000000001, 12.481199999999999, 12.494199999999999, 12.654999999999999, 12.7499, 12.6968, 12.5587, 12.592599999999999, 13.273, 12.667899999999999, 12.716100000000001, 12.6381, 12.575699999999999, 12.621499999999999, 12.551500000000001, 12.960000000000001, 12.773999999999999, 12.572800000000001, 12.7224, 12.452500000000001, 12.776400000000001, 12.8934, 12.4435, 12.658300000000001, 12.536300000000001, 12.518700000000001, 12.559699999999999, 12.6592, 12.725, 12.565799999999999, 12.5596, 12.5318, 12.479200000000001, 12.6785, 12.4556, 12.675000000000001, 12.652900000000001, 12.569000000000001, 12.5998, 12.5633, 12.389699999999999, 12.829700000000001, 12.895300000000001, 12.673400000000001, 12.8293, 12.7674, 12.8634, 12.681699999999999, 12.674799999999999, 12.6562, 12.531000000000001, 12.824299999999999, 12.7775, 12.6708, 12.728300000000001, 12.700200000000001, 12.728999999999999, 12.8392, 12.7919, 12.699299999999999, 12.7499, 12.681100000000001, 12.7493, 12.8132, 12.906499999999999, 12.9123, 12.6196, 12.491099999999999, 12.664199999999999, 12.7636, 12.6975, 12.657, 12.7326, 12.8291, 12.6395, 12.577400000000001, 12.5435, 12.9076, 12.7348, 12.7441, 12.835599999999999, 12.823, 12.592000000000001, 12.692399999999999, 12.8172, 12.7354, 12.6275, 12.6112, 12.5785, 12.808299999999999, 12.7186, 12.6989, 12.6709, 12.565300000000001, 12.696099999999999, 12.691800000000001, 12.635300000000001, 12.708600000000001, 13.128399999999999, 12.652900000000001, 12.6212, 12.6426, 12.7851, 12.715299999999999, 12.792199999999999, 12.7658, 12.714, 12.689299999999999, 12.728999999999999, 12.5802, 12.7555, 12.9628, 12.6891, 12.7066, 12.6911, 12.6478, 12.7498, 12.6593, 12.4335, 12.487399999999999, 12.5954, 12.537699999999999, 12.608000000000001, 12.5298, 12.620799999999999, 12.5787, 12.6616, 12.8352, 12.796099999999999, 12.7524, 12.6989, 12.815300000000001, 12.688599999999999, 12.5962, 12.611700000000001, 12.6622, 13.2227, 12.8238, 12.792299999999999, 12.587899999999999, 12.4404, 12.746700000000001, 12.728, 12.880100000000001, 12.5829, 12.630000000000001, 12.809100000000001, 13.010400000000001, 12.272399999999999, 12.1387, 12.1553, 12.051399999999999, 12.3141, 12.107200000000001, 12.1096, 12.277100000000001, 12.8781, 12.464, 12.496, 12.5312, 12.3894, 12.360799999999999, 12.176600000000001, 12.197900000000001, 12.083399999999999, 12.1881, 12.3729, 12.203900000000001, 12.440899999999999, 12.5868, 12.694900000000001, 12.298, 12.0985, 12.4506, 12.0367, 12.0692, 12.1503, 12.2281, 12.102399999999999, 12.0463, 12.028, 12.4472, 12.601699999999999, 12.3248, 12.720599999999999, 12.9861, 12.639699999999999, 12.4758, 12.5657, 12.7051, 12.8729, 12.608700000000001, 12.8856, 12.7516, 12.587899999999999, 12.9473, 12.6389, 12.619199999999999, 12.5794, 12.850300000000001, 12.918699999999999, 12.8428, 12.794499999999999, 12.6091, 12.7972, 12.5928, 12.661099999999999, 12.849399999999999, 12.874499999999999, 12.866199999999999, 12.8416, 12.7286, 12.8026, 12.718299999999999, 12.858599999999999, 12.6549, 12.7525, 12.6318, 12.638500000000001, 12.466100000000001, 12.8202, 12.621, 12.7409, 12.581200000000001, 12.770799999999999, 12.8041, 13.033300000000001, 12.5479, 12.738200000000001, 12.4472, 12.5037, 12.553699999999999, 12.7248, 13.1623, 13.075100000000001, 12.757899999999999, 12.863300000000001, 12.8979, 12.764200000000001, 13.145799999999999, 12.800800000000001, 13.113899999999999, 12.910500000000001, 12.883900000000001, 13.021800000000001, 12.8927, 12.8843, 12.9132, 12.7646, 12.948, 12.5288, 12.7555, 12.670999999999999, 12.6647, 12.6867, 12.7258, 12.400600000000001, 12.6631, 12.8581, 13.161199999999999, 12.880100000000001, 12.786300000000001, 12.8803, 12.812799999999999, 12.6814, 12.749000000000001, 12.811199999999999, 12.8635, 12.706899999999999, 12.735300000000001, 12.752700000000001, 12.728899999999999, 12.803000000000001, 12.6479, 12.8169, 12.8566, 12.7791, 12.5982, 12.435600000000001, 12.4239, 12.5618, 12.689500000000001, 12.733700000000001, 12.6769, 13.0749, 13.145099999999999, 12.731199999999999, 12.4427, 12.415800000000001, 12.6511, 12.809100000000001, 12.6881, 12.6076, 12.659800000000001, 12.6111, 12.883599999999999, 13.0002, 12.5892, 12.535500000000001, 13.0435, 12.7822, 12.6595, 12.7859, 12.840299999999999, 12.800700000000001, 12.852499999999999, 12.881600000000001, 12.7652, 12.9719, 12.8261, 12.805899999999999, 12.744300000000001, 12.781499999999999, 12.7279, 12.772, 12.779400000000001, 12.7072, 12.772399999999999, 12.689500000000001, 12.786300000000001, 12.7248, 12.876099999999999, 12.739800000000001, 12.6677, 12.669, 12.504799999999999, 12.8331, 12.8162, 12.735200000000001, 12.7661, 12.678100000000001, 12.749700000000001]
}
